affiliation,pmid,lon,lat,Country,Address
"Department Of Neurosurgery, West Virginia University, 1 Medical Center Drive, Suite 4300, Morgantown, Wv, 26505, Usa. Cpcifarelli@Hsc.wvu.edu.",31654248,-79.9581012,39.6548131,United States,"1 Medical Center Dr, Morgantown, Wv 26506, Usa"
"Department Of Radiation Oncology, West Virginia University, Morgantown, Wv, Usa. Cpcifarelli@Hsc.wvu.edu.",31654248,-79.9697147,39.648035900000004,United States,"Morgantown, Wv 26506, Usa"
"Department Of Neurosurgery, Medical Faculty Mannheim, Heidelberg University, Mannheim, Germany.",31654248,8.4864038999999991,49.49257009999999,Germany,"Theodor-Kutzer-Ufer 1-3, 68167 Mannheim, Germany"
"Department Of Radiation Oncology, Upmc, Pittsburgh, Pa, Usa.",31654248,-79.9394822,40.4548649,United States,"5230 Centre Ave, Pittsburgh, Pa 15232, Usa"
"Department Of Radiation Oncology, West Virginia University, Morgantown, Wv, Usa.",31654248,-79.9573549,39.6534151,United States,"1 Medical Center Dr, Morgantown, Wv 26506, Usa"
"Department Of Radiation Oncology, University Medical Center Augsburg, Augsburg, Germany.",31654248,10.89779,48.3705449,Germany,"Augsburg, Germany"
"Department Of Radiation Oncology, Medical Faculty Mannheim, Heidelberg University, Mannheim, Germany.",31654248,8.485685799999999,49.49217609999999,Germany,"Umm - Klinik Für Strahlentherapie Und Radioonkologie, Theodor-Kutzer-Ufer 1-3, 68167 Mannheim, Germany"
King Saud University.,31650905,46.6236596,24.7252026,Saudi Arabia,"King Saud University, Riyadh 11451, Saudi Arabia"
West Virginia University.,31650905,-79.9697147,39.648035900000004,United States,"Morgantown, Wv 26506, Usa"
"Department Of Behavioral Medicine And Psychiatry, West Virginia University School Of Medicine.",31647279,-79.955772,39.6548872,United States,"930 Chestnut Ridge Rd, Morgantown, Wv 26505, Usa"
"Department Of Behavioral Medicine, Rockefeller Neuroscience Institute, West Virginia University School Of Medicine.",31647279,-79.9600936,39.6533033,United States,"33 Medical Center Dr, Morgantown, Wv 26505, Usa"
"Department Of Physiology And Pharmacology, West Virginia University, Morgantown, Wv, Usa.",31640919,-79.9697147,39.648035900000004,United States,"Morgantown, Wv 26506, Usa"
"Division Of Cardiology, Department Of Medicine, Karolinska University Hospital, Karolinska Institutet, Stockholm, Sweden.",31640919,18.0236579,59.34814839999999,Sweden,"Solnavägen 1, 171 77 Solna, Sweden"
"Division Of Experimental Cardiology, Department Of Cardiology, Erasmus University Medical Center, Rotterdam, The Netherlands; Walter-Brendel-Centre Of Experimental Medicine, University Hostpital, Lmu Munich, Munich, Germany.",31640919,4.467854099999999,51.9108848,Netherlands,"Doctor Molewaterplein 40, 3015 Gd Rotterdam, Netherlands"
"Division Of Experimental Cardiology, Department Of Cardiology, Erasmus University Medical Center, Rotterdam, The Netherlands.",31640919,4.467854099999999,51.9108848,Netherlands,"Doctor Molewaterplein 40, 3015 Gd Rotterdam, Netherlands"
"Department Of Physiology And Pharmacology, West Virginia University, Morgantown, Wv, Usa; Division Of Cardiology, Department Of Medicine, Karolinska University Hospital, Karolinska Institutet, Stockholm, Sweden. Electronic Address: Zhzhou2015@Gmail.com.",31640919,18.0300592,59.3484728,Sweden,"Eugeniavägen 3, 171 64 Solna, Sweden"
"Department Of Internal Medicine, West Virginia University Charleston Division, Charleston Area Medical Center, Charleston, Wv, Usa.",31637062,-81.6043107,38.3302019,United States,"3110 Maccorkle Ave Se, Charleston, Wv 25304, Usa"
"Department Of Clinical And Translational Sciences, Joan C. Edwards School Of Medicine, Marshall University, Huntington, West Virginia, Usa. Butts15@Marshall.edu.",31635319,-82.4268836,38.4090996,United States,"1600 Medical Center Dr, Huntington, Wv 25701, Usa"
"Department Of Clinical And Translational Sciences, Joan C. Edwards School Of Medicine, Marshall University, Huntington, West Virginia, Usa. Paulraj@Marshall.edu.",31635319,-82.4268836,38.4090996,United States,"1600 Medical Center Dr, Huntington, Wv 25701, Usa"
"Department Of Clinical And Translational Sciences, Joan C. Edwards School Of Medicine, Marshall University, Huntington, West Virginia, Usa. Haynesje@Marshall.edu.",31635319,-82.4268836,38.4090996,United States,"1600 Medical Center Dr, Huntington, Wv 25701, Usa"
"Department Of Clinical And Translational Sciences, Joan C. Edwards School Of Medicine, Marshall University, Huntington, West Virginia, Usa. Arthursu@Marshall.edu.",31635319,-82.4268836,38.4090996,United States,"1600 Medical Center Dr, Huntington, Wv 25701, Usa"
"Department Of Clinical And Translational Sciences, Joan C. Edwards School Of Medicine, Marshall University, Huntington, West Virginia, Usa. Singhs@Marshall.edu.",31635319,-82.4268836,38.4090996,United States,"1600 Medical Center Dr, Huntington, Wv 25701, Usa"
"Department Of Clinical And Translational Sciences, Joan C. Edwards School Of Medicine, Marshall University, Huntington, West Virginia, Usa. Sundaramu@Marshall.edu.",31635319,-82.4268836,38.4090996,United States,"1600 Medical Center Dr, Huntington, Wv 25701, Usa"
"Department Of Microbiology, Immunology And Cell Biology, Robert C. Byrd Health Sciences Center, School Of Medicine, West Virginia University, Morgantown, Wv, Usa.",31632618,-79.9697147,39.648035900000004,United States,"Morgantown, Wv 26506, Usa"
"West Virginia Clinical And Translational Science Institute (Wvctsi), West Virginia University, Morgantown, Wv, Usa.",31632618,-79.9697147,39.648035900000004,United States,"Morgantown, Wv 26506, Usa"
"Department Of Surgery, College Of Medicine, Wexner Medical Center, The Ohio State University, Columbus, Oh, Usa.",31632618,-83.0178656,39.9954771,United States,"395 W 12th Ave #670, Columbus, Oh 43210, Usa"
"Department Of Neuroscience, School Of Medicine; Rockefeller Neuroscience Institute, West Virginia University, Morgantown, Wv, Usa.",31632618,-79.9600936,39.6533033,United States,"33 Medical Center Dr, Morgantown, Wv 26505, Usa"
"Department Of Statistics, West Virginia University, Morgantown, Wv, Usa.",31632618,-79.9697147,39.648035900000004,United States,"Morgantown, Wv 26506, Usa"
"Department Of Critical Care, Nationwide Children's Hospital, Columbus, Oh, Usa.",31632618,-82.97926799999999,39.95329359999999,United States,"700 Children's Dr, Columbus, Oh 43205, Usa"
"Department Of Molecular And Comparative Pathobiology, The Johns Hopkins University School Of Medicine, Baltimore, Md, Usa.",31632618,-76.5935207,39.2992589,United States,"Baltimore, Md 21205, Usa"
"Robert C. Byrd Health Sciences Center, School Of Medicine, West Virginia University, Morgantown, Wv, Usa.",31632618,-79.9580682,39.6549175,United States,"1 Medical Center Dr #1000, Morgantown, Wv 26506, Usa"
"West Virginia University, Department Of Microbiology, Immunology, And Cell Biology, Morgantown, Wv, 26506, Usa.",31624329,-79.9581012,39.6548131,United States,"1 Medical Center Dr, Morgantown, Wv 26506, Usa"
"West Virginia University, Department Of Microbiology, Immunology, And Cell Biology, Morgantown, Wv, 26506, Usa. Gpmeares@Hsc.wvu.edu.",31624329,-79.9581012,39.6548131,United States,"1 Medical Center Dr, Morgantown, Wv 26506, Usa"
"West Virginia University, Department Of Neuroscience, Morgantown, Wv, 26506, Usa. Gpmeares@Hsc.wvu.edu.",31624329,-79.9580682,39.6549175,United States,"1 Medical Center Dr #1000, Morgantown, Wv 26506, Usa"
"Service De Néonatologie, Centre Hospitalier Universitaire Sud Réunion, Saint-Pierre Cedex, La Réunion, France.",31622409,55.4932086,-21.3463797,France,"410, 97 Avenue Du Président Mitterrand, Réunion"
"Centre D'etudes Périnatales Océan Indien (Cepoi), Centre Hospitalier Universitaire Sud Réunion, Saint-Pierre Cedex, La Réunion, France.",31622409,55.4932086,-21.3463797,France,"410, 97 Avenue Du Président Mitterrand, Réunion"
"Department Of Obstetrics &Amp; Gynaecology, University Of Adelaide, Robinson Institute, Lyell Mcewin Hospital, Adelaide, Australia.",31622409,-95.9260233,36.1031728,United States,"4502 E 41st St, Tulsa, Ok 74135, Usa"
"Department Of Obstetrics And Gynaecology, Policlinico Of Abano Terme, Padua, Abano Terme, Italy.",31622409,11.7882998,45.3587173,Italy,"35031 Abano Terme, Province Of Padua, Italy"
"Service De Gynécologie Et Obstétrique, Centre Hospitalier Universitaire Sud Réunion, Saint-Pierre Cedex, La Réunion, France.",31622409,55.4932086,-21.3463797,France,"410, 97 Avenue Du Président Mitterrand, Réunion"
"Department Of Epidemiology, School Of Public Health, West Virginia University, Morgantown, Wv, United States Of America.",31622409,-79.9581007,39.654813,United States,"Morgantown, Wv 26506, Usa"
"Department Of Cardiology, Heart And Vascular Institute, Cleveland Clinic, Euclid Avenue, Cleveland, Oh 44195, Usa.",31609450,-81.62091629999999,41.5027421,United States,"9500 Euclid Ave, Cleveland, Oh 44195, Usa"
"Department Of Internal Medicine, West Virginia University, Morgantown, Wv, 26506 Usa.",31609450,-79.9697147,39.648035900000004,United States,"Morgantown, Wv 26506, Usa"
"Department Of Internal Medicine, Creighton University, 7500 Mercy Road, Omaha, Ne 68124, Usa.",31609450,-96.0307682,41.23953059999999,United States,"7500 Mercy Rd, Omaha, Ne 68124, Usa"
"Department Of Internal Medicine, Guthrie/Robert Packer Hospital, Guthrie Square, Sayre, Pa 18840, Usa.",31609450,-76.5202662,41.9803037,United States,"1 Guthrie Square, Sayre, Pa 18840, Usa"
"Department Of Internal Medicine, John H Stroger Jr, Hospital Of Cook County, 969 W Ogden Ave, Chicago, Il 60612, Usa.",31609450,-87.67369,41.8728476,United States,"1969 Ogden Ave, Chicago, Il 60612, Usa"
"Department Of Dermatology, West Virginia University, Morgantown, Wv, U.s.a.",31605620,-79.9697147,39.648035900000004,United States,"Morgantown, Wv 26506, Usa"
"Dermatology &Amp; Mohs Surgery, Sacred Heart Cancer Center, Pensacola, Fl, U.s.a.",31605620,-95.97429509999999,36.7506397,United States,"309 Se Frank Phillips Blvd, Bartlesville, Ok 74003, Usa"
"Section Of Dermatology, Va Tech School Of Medicine, Roanoke, Va, U.s.a.",31605620,-79.9425985,37.2575796,United States,"2 Riverside Circle, Roanoke, Va 24016, Usa"
"Department Of Pathology, Va Tech School Of Medicine, Roanoke, Va, U.s.a.",31605620,-79.9425985,37.2575796,United States,"2 Riverside Circle, Roanoke, Va 24016, Usa"
"1department Of Microbiology, Immunology, And Cell Biology, West Virginia University, Morgantown, Wv Usa.",31602318,-79.9697147,39.648035900000004,United States,"Morgantown, Wv 26506, Usa"
"2vaccine Development Center At West Virginia University Health Sciences Center West Virginia University, Morgantown, Wv Usa.",31602318,-79.9697147,39.648035900000004,United States,"Morgantown, Wv 26506, Usa"
"3west Virginia University School Of Medicine, Morgantown, Wv Usa.",31602318,-79.9581012,39.6548131,United States,"1 Medical Center Dr, Morgantown, Wv 26506, Usa"
"4instituto De Biotecnología Y Biología Molecular (Ibbm)-Cct-Conicet-La Plata, Departamento De Ciencias Biológicas, Facultad De Ciencias Exactas, Universidad Nacional De La Plata, La Plata, Argentina.",31602318,-57.9426432,-34.9074389,Argentina,"Calle 50 & Calle 115, La Plata, Provincia De Buenos Aires, Argentina"
"Department Of Neurosurgery, School Of Medicine, West Virginia University, Morgantown, West Virginia.",31599324,-79.9581012,39.6548131,United States,"1 Medical Center Dr, Morgantown, Wv 26506, Usa"
"Department Of Radiation Oncology, School Of Medicine, West Virginia University, Morgantown, West Virginia.",31599324,-79.9573549,39.6534151,United States,"1 Medical Center Dr, Morgantown, Wv 26506, Usa"
"West Virginia Clinical And Translational Science Institute, School Of Medicine, West Virginia University, Morgantown, West Virginia.",31599324,-79.9581012,39.6548131,United States,"1 Medical Center Dr, Morgantown, Wv 26506, Usa"
"Department Of Stereotactic And Radiation Neurosurgery, Na Homolce Hospital, Prague, Czech Republic.",31599324,14.3544551,50.0747247,Czechia,"2, Roentgenova 37, 150 00 Praha-Praha 5, Czechia"
"Mayfield Clinic, Jewish Hospital, Cincinnati, Ohio.",31599324,-84.44509459999999,39.1512629,United States,"4020 Smith Rd, Cincinnati, Oh 45209, Usa"
"Department Of Neurosurgery, Taipei Veterans General Hospital, Taipei, Taiwan.",31599324,121.5201492,25.1197546,Taiwan,"No. 201, Section 2, Shipai Road, Beitou District, Taipei City, Taiwan 112"
"Department Of Neurosurgery, Cleveland Clinic, Cleveland, Ohio.",31599324,-81.62172199999999,41.502823,United States,"9500 Euclid Ave, Cleveland, Oh 44195, Usa"
"Department Of Radiation Oncology, Beaumont Health System, Royal Oak, Michigan.",31599324,-83.19099849999999,42.5131976,United States,"3601 W 13 Mile Rd, Royal Oak, Mi 48073, Usa"
"Division Of Neurosurgery, Faculté De Médecine Et Des Sciences De La Santé, Université De Sherbrooke, Centre De Recherche Du Chus, Sherbrooke, Canada.",31599324,-71.8684937,45.4475224,Canada,"3001 12e Avenue N Immeuble X1, Sherbrooke, Qc J1h 5n4, Canada"
"Department Of Neurosurgery, School Of Medicine, University Of Virginia, Charlottesville, Virginia.",31599324,-78.4988225,38.0311849,United States,"1215 Lee St, Charlottesville, Va 22908, Usa"
"Department Of Neurosurgery, Yale School Of Medicine, Yale University, New Haven, Connecticut.",31599324,-72.9338698,41.30323,United States,"333 Cedar St, New Haven, Ct 06510, Usa"
"Department Of Radiation Oncology, Yale School Of Medicine, Yale University, New Haven, Connecticut.",31599324,-72.9338698,41.30323,United States,"333 Cedar St, New Haven, Ct 06510, Usa"
"Department Of Neurosurgery, University Of Pittsburgh Medical Center, Pittsburgh, Pennsylvania.",31599324,-79.9609827,40.4425606,United States,"200 Lothrop St Suite B-400, Pittsburgh, Pa 15213, Usa"
"Mayo Clinic, Neurology, Phoenix, Arizona, Usa.",31596679,-111.9560846,33.658912,United States,"5779 E Mayo Blvd, Phoenix, Az 85054, Usa"
"Department Of Neurology, School Of Medicine, West Virginia University, Morgantown, West Virginia, Usa.",31596679,-79.9697147,39.648035900000004,United States,"Morgantown, Wv 26506, Usa"
"School Of Medicine, West Virginia University, Morgantown, West Virginia, Usa.",31596679,-79.9581012,39.6548131,United States,"1 Medical Center Dr, Morgantown, Wv 26506, Usa"
"Department Of Emergency Medicine, West Virginia University, Morgantown, West Virginia, Usa.",31596679,-79.9697147,39.648035900000004,United States,"Morgantown, Wv 26506, Usa"
"School Of Medicine, West Virginia University, Morgantown, Wv, Usa.",31594377,-79.9581012,39.6548131,United States,"1 Medical Center Dr, Morgantown, Wv 26506, Usa"
"Memorial Radiation Oncology Medical Group, Fountain Valley, Ca, Usa.",31594377,-117.9333707,33.7140031,United States,"11190 Warner Ave # 115, Fountain Valley, Ca 92708, Usa"
"Department Of Radiation Oncology, Perelman School Of Medicine, Philadelphia, Pa, Usa.",31594377,-75.1928033,39.9475305,United States,"3400 Civic Center Boulevard Concourse Level, Philadelphia, Pa 19104, Usa"
"Department Of Radiation Oncology, West Virginia University School Of Medicine, Morgantown, Wv, Usa. Malcolm.mattes@Gmail.com.",31594377,-79.9581012,39.6548131,United States,"1 Medical Center Dr, Morgantown, Wv 26506, Usa"
"Department Of Neurological Surgery, University Of Virginia, Charlottesville, Virginia.",31584074,-78.4988225,38.0311849,United States,"1215 Lee St, Charlottesville, Va 22908, Usa"
"Department Of Neurological Surgery, University Of Pittsburgh, Pittsburgh, Pennsylvania.",31584074,-79.9609827,40.4425606,United States,"200 Lothrop St Suite B-400, Pittsburgh, Pa 15213, Usa"
"School Of Medicine, Yale University, New Haven, Connecticut.",31584074,-72.9338698,41.30323,United States,"333 Cedar St, New Haven, Ct 06510, Usa"
"Department Of Neurological Surgery, University Of Pennsylvania, Philadelphia, Pennsylvania.",31584074,-75.1932593,39.9496066,United States,"3400 Spruce St, Philadelphia, Pa 19104, Usa"
"Department Of Neurological Surgery, Université De Sherbrooke, Centre De Recherche Du Chus, Sherbrooke, Canada.",31584074,-71.86956570000001,45.4486844,Canada,"12e Avenue N Porte 6, Sherbrooke, Qc J1h 5n4, Canada"
"Department Of Neurological Surgery, University Of Manitoba, Winnipeg, Canada.",31584074,-97.1366259,49.8075008,Canada,"66 Chancellors Cir, Winnipeg, Mb R3t 2n2, Canada"
"Department Of Radiation Oncology, Beaumont Health System, Royal Oak, Michigan.",31584074,-83.19099849999999,42.5131976,United States,"3601 W 13 Mile Rd, Royal Oak, Mi 48073, Usa"
"Department Of Neurological Surgery, West Virginia University, Morgantown, West Virginia.",31584074,-79.9574781,39.6534472,United States,"1 Medical Center Dr, Morgantown, Wv 26506, Usa"
"Department Of Neurological Surgery, Na Homolce Hospital, Prague, Czech Republic.",31584074,14.3544551,50.0747247,Czechia,"2, Roentgenova 37, 150 00 Praha-Praha 5, Czechia"
"Department Of Neurological Surgery, University Of Puerto Rico, San Juan, Puerto Rico.",31584074,-66.0527226,18.4089741,United States,"Torre Auxiliio Mutuo, 735 Avenida De La Constitución Suite 404, San Juan, 00917, Puerto Rico"
"Department Of Neurology, West Virginia University, Morgantown, Wv 26506, Usa.",31583134,-79.9697147,39.648035900000004,United States,"Morgantown, Wv 26506, Usa"
"Department Of Pathology, Anatomy And Laboratory Medicine, West Virginia University, Morgantown, Wv 26506, Usa.",31583134,-79.9573549,39.6534151,United States,"1 Medical Center Dr, Morgantown, Wv 26506, Usa"
"Department Of Medicine, Creighton University Medical Center, Omaha, Nebraska.",31575422,-96.0308204,41.2390765,United States,"7500 Mercy Rd, Omaha, Ne 68124, Usa"
"Department Of Medicine, John H. Stroger, Jr. Hospital Of Cook County, Chicago, Illinois.",31575422,-87.67369,41.8728476,United States,"1969 Ogden Ave, Chicago, Il 60612, Usa"
"Department Of Cardiovascular Surgery, Louis Stokes Cleveland Va Medical Center, Cleveland, Ohio.",31575422,-81.61374479999999,41.5137305,United States,"10701 East Blvd, Cleveland, Oh 44106, Usa"
"Department Of Cardiovascular Medicine, Heart And Vascular Institute, Cleveland Clinic, Cleveland, Ohio.",31575422,-81.62091629999999,41.5027421,United States,"9500 Euclid Ave, Cleveland, Oh 44195, Usa"
"Department Of Cardiovascular Medicine, Albert Einstein Medical Center, Philadelphia, Pennsylvania.",31575422,-75.14235339999999,40.0366347,United States,"5501 Old York Rd, Philadelphia, Pa 19141, Usa"
"West Virginia University, Morgantown, West Virginia.",31575422,-79.9697147,39.648035900000004,United States,"Morgantown, Wv 26506, Usa"
"Department Of Cardiovascular Medicine, Heart And Vascular Institute, Cleveland Clinic, Cleveland, Ohio; Heart And Vascular Center, Cleveland Clinic Akron General, Akron, Ohio.",31575422,-81.53099069999999,41.0782631,United States,"1 Akron General Ave, Akron, Oh 44307, Usa"
"Department Of Cardiovascular Medicine, Heart And Vascular Institute, Cleveland Clinic, Cleveland, Ohio; Heart And Vascular Center, Cleveland Clinic Akron General, Akron, Ohio. Electronic Address: Kalramd.ankur@Gmail.com.",31575422,-81.53099069999999,41.0782631,United States,"1 Akron General Ave, Akron, Oh 44307, Usa"
"Department Of Medicine, Harvard Medical School, Boston, Ma, Usa.",31570695,-71.1041786,42.3356352,United States,"25 Shattuck St, Boston, Ma 02115, Usa"
"Division Of Hematology-Oncology, Mayo Clinic, Jacksonville, Fl, Usa. Ailawadhi.sikander@Mayo.edu.",31570695,-81.4414608,30.2627916,United States,"4500 San Pablo Rd S, Jacksonville, Fl 32224, Usa"
"Department Of Medicine, Mayo Clinic, Jacksonville, Fl, Usa.",31570695,-81.4432369,30.2622794,United States,"4500 San Pablo Road, Jacksonville, Fl 32224, Usa"
"Division Of Hematology-Oncology, Mayo Clinic, Jacksonville, Fl, Usa.",31570695,-81.4414608,30.2627916,United States,"4500 San Pablo Rd S, Jacksonville, Fl 32224, Usa"
"Department Of Cancer Biology, Mayo Clinic, Jacksonville, Fl, Usa.",31570695,-81.44514559999999,30.2626481,United States,"4500 San Pablo Rd S, Jacksonville, Fl 32224, Usa"
"Division Of Radiation Oncology, Allegheny Health Network Cancer Institute, Pittsburgh, Pennsylvania.",31567930,-79.9467591,40.4608578,United States,"4815 Liberty Ave Suite 340, Pittsburgh, Pa 15224, Usa"
"Division Of Medical Oncology, Allegheny Health Network Cancer Institute, Pittsburgh, Pennsylvania.",31567930,-79.9467591,40.4608578,United States,"4815 Liberty Ave Suite 340, Pittsburgh, Pa 15224, Usa"
"Division Of Colorectal Surgery, Allegheny Health Network, Pittsburgh, Pennsylvania.",31567930,-80.00781359999999,40.4572118,United States,"1307 Federal St, Pittsburgh, Pa 15212, Usa"
"School Of Pharmacy, West Virginia University, Morgantown, Wv.",31551652,-79.9582192,39.655109,United States,"Robert C. Bryd Health Sciences Center, 5706 Health Sciences Ctr S, Morgantown, Wv 26506, Usa"
"Behavioral Medicine &Amp; Psychiatry, West Virginia University, Morgantown, Wv.",31551652,-97.24636489999999,37.7175215,United States,"7829 E Rockhill St, Wichita, Ks 67206, Usa"
"Department Of Medical Oncology, Dana-Farber Cancer Institute And Harvard Medical School, Boston, Massachusetts. Chen_yuan@Dfci.harvard.edu.",31548349,-71.1081418,42.3375158,United States,"450 Brookline Ave, Boston, Ma 02215, Usa"
"Department Of Medical Oncology, Dana-Farber Cancer Institute And Harvard Medical School, Boston, Massachusetts.",31548349,-71.1081418,42.3375158,United States,"450 Brookline Ave, Boston, Ma 02215, Usa"
"Department Of Pediatrics, Medical University Of South Carolina, Charleston, South Carolina.",31548349,-79.9492523,32.7870801,United States,"30 Bee St #120, Charleston, Sc 29425, Usa"
"Department Of Biostatistics And Bioinformatics, Duke University School Of Medicine, Durham, North Carolina.",31548349,-78.9382286,36.0014258,United States,"Durham, Nc 27708, Usa"
"Alliance Statistics And Data Center, Mayo Clinic, Rochester, Minnesota.",31548349,-92.453953,44.0531588,United States,"2720 N Broadway Ave, Rochester, Mn 55906, Usa"
"Southeast Clinical Oncology Research (Scor) Consortium, Winston-Salem, North Carolina.",31548349,-80.2789099,36.0969766,United States,"2150 Country Club Rd, Winston-Salem, Nc 27104, Usa"
"Department Of Medicine, Indiana University School Of Medicine, Indianapolis, Indiana.",31548349,-86.1649229,39.788065,India,"Indianapolis, In 46202, Usa"
"Eshelman School Of Pharmacy And Lineberger Comprehensive Cancer Center, University Of North Carolina At Chapel Hill, Chapel Hill, North Carolina.",31548349,-79.0509848,35.9043969,United States,"Cancer Hospital, 101 Manning Dr, Chapel Hill, Nc 27514, Usa"
"Division Of Medical Oncology, Norris Comprehensive Cancer Center, Keck School Of Medicine, University Of Southern California, Los Angeles, California.",31548349,-118.2048393,34.0613426,United States,"1441 Eastlake Ave, Los Angeles, Ca 90033, Usa"
"Swog Group Chair's Office/Knight Cancer Institute, Oregon Health And Science University, Portland, Oregon.",31548349,-122.6891258,45.4963132,United States,"840 S Gaines St, Portland, Or 97239, Usa"
"West Virginia University Cancer Institute, Morgantown, West Virginia.",31548349,-79.9584371,39.6539232,United States,"1 Medical Center Dr, Morgantown, Wv 26506, Usa"
"Department Of Medicine, University Of California San Francisco (Ucsf) School Of Medicine, San Francisco, California.",31548349,-122.4597539,37.7627015,United States,"533 Parnassus Ave, San Francisco, Ca 94143, Usa"
"Yale Cancer Center And Smilow Cancer Hospital, New Haven, Connecticut.",31548349,-72.936037,41.3046434,United States,"35 Park St, New Haven, Ct 06511, Usa"
"Department Of Biomedical Sciences, Joan C. Edwards School Of Medicine, Marshall University, Huntington, Wv, 25755, United States.",31542429,-82.4268836,38.4090996,United States,"1600 Medical Center Dr, Huntington, Wv 25701, Usa"
"Department Of Biomedical Sciences, Joan C. Edwards School Of Medicine, Marshall University, Huntington, Wv, 25755, United States. Electronic Address: Koce@Marshall.edu.",31542429,-82.4268836,38.4090996,United States,"1600 Medical Center Dr, Huntington, Wv 25701, Usa"
"International Drug Development Institute, Louvain-La-Neuve, Belgium.",31539075,4.6118324,50.66808100000001,Belgium,"Louvain-La-Neuve, 1348 Ottignies-Louvain-La-Neuve, Belgium"
"Hasselt University, Diepenbeek, Belgium.",31539075,5.342293,50.9335322,Belgium,"Martelarenlaan 42, 3500 Hasselt, Belgium"
"Division Of Biomedical Statistics And Informatics, Mayo Clinic, Rochester, Minnesota.",31539075,-94.6858998,46.729553,United States,"Minnesota, Usa"
"The University Of Sydney, Camperdown, New South Wales, Australia.",31539075,151.1873494,-33.8885748,Australia,"Camperdown Nsw 2006, Australia"
"Academic Medical Centre, Amsterdam, The Netherlands.",31539075,4.959209599999999,52.2938961,Netherlands,"Meibergdreef 9, 1105 Az Amsterdam, Netherlands"
"Flevohospital, Almere, The Netherlands.",31539075,5.223541399999999,52.3692208,Netherlands,"Hospitaalweg 1, 1315 Ra Almere, Netherlands"
"Department Of Internal Medicine Ii And Clinic, University Of Hamburg, Hamburg, Germany.",31539075,9.984619499999999,53.5665641,Germany,"20146 Hamburg, Germany"
"Hospital Clinico San Carlos And Centro De Investigación Biomédica En Red Cáncer, Ciberonc, Madrid, Spain.",31539075,-3.7197595,40.4407004,Spain,"Calle Del Prof Martín Lagos, S/N, 28040 Madrid, Spain"
"Centre René Gauducheau, St Herblain, France.",31539075,-1.6372547,47.23769679999999,France,"Boulevard Professeur Jacques Monod, 44800 Saint-Herblain, France"
"University Hospital S Chiara, Pisa, Italy.",31539075,10.3949045,43.7219255,Italy,"Via Roma, 67, 56100 Pisa Pi, Italy"
"Dana-Farber Cancer Institute, Boston, Massachusetts.",31539075,-71.1081418,42.3375158,United States,"450 Brookline Ave, Boston, Ma 02215, Usa"
"West Virginia University Cancer Institute, Morgantown.",31539075,-79.9584371,39.6539232,United States,"1 Medical Center Dr, Morgantown, Wv 26506, Usa"
"David Geffen School Of Medicine, University Of California, Los Angeles.",31539075,-118.4423562,34.06428289999999,United States,"10833 Le Conte Ave, Los Angeles, Ca 90095, Usa"
